{
  "schema_version": "provider-certification-v1",
  "generated_at": "2026-09-10T16:06:34+00:00",
  "policy": {
    "default_ttl_seconds": 86400,
    "minimum_completeness": 0.8,
    "daily_risk_levels": [
      "critical",
      "high"
    ],
    "weekly_risk_levels": [
      "medium"
    ]
  },
  "summary": {
    "providers": 81,
    "promotable": 0,
    "blocked": 81,
    "by_smoke_frequency": {
      "daily": 21,
      "weekly": 54,
      "monthly": 6
    }
  },
  "reports": [
    {
      "provider": "bnp_pangea",
      "freshness": "fresh",
      "alerts": [
        {
          "code": "completeness_unknown",
          "severity": "blocking",
          "message": "completeness was not measured",
          "blocks_promotion": true
        }
      ],
      "can_promote": false,
      "recommended_smoke": "weekly",
      "parser_version": null,
      "technical_gate": true,
      "technical_promotion_eligible": false
    },
    {
      "provider": "cjf_jurisprudencia",
      "freshness": "fresh",
      "alerts": [
        {
          "code": "completeness_unknown",
          "severity": "blocking",
          "message": "completeness was not measured",
          "blocks_promotion": true
        }
      ],
      "can_promote": false,
      "recommended_smoke": "weekly",
      "parser_version": null,
      "technical_gate": false,
      "technical_promotion_eligible": false
    },
    {
      "provider": "cnj_jurisprudencia",
      "freshness": "fresh",
      "alerts": [
        {
          "code": "completeness_unknown",
          "severity": "blocking",
          "message": "completeness was not measured",
          "blocks_promotion": true
        }
      ],
      "can_promote": false,
      "recommended_smoke": "weekly",
      "parser_version": null,
      "technical_gate": true,
      "technical_promotion_eligible": false
    },
    {
      "provider": "eproc_jurisprudencia_federal",
      "freshness": "missing",
      "alerts": [
        {
          "code": "evidence_missing",
          "severity": "blocking",
          "message": "no bounded evidence timestamp",
          "blocks_promotion": true
        },
        {
          "code": "completeness_unknown",
          "severity": "blocking",
          "message": "completeness was not measured",
          "blocks_promotion": true
        }
      ],
      "can_promote": false,
      "recommended_smoke": "weekly",
      "parser_version": null,
      "technical_gate": false,
      "technical_promotion_eligible": false
    },
    {
      "provider": "falcao_jt",
      "freshness": "missing",
      "alerts": [
        {
          "code": "evidence_missing",
          "severity": "blocking",
          "message": "no bounded evidence timestamp",
          "blocks_promotion": true
        },
        {
          "code": "completeness_unknown",
          "severity": "blocking",
          "message": "completeness was not measured",
          "blocks_promotion": true
        }
      ],
      "can_promote": false,
      "recommended_smoke": "weekly",
      "parser_version": null,
      "technical_gate": false,
      "technical_promotion_eligible": false
    },
    {
      "provider": "justica_eleitoral_sjur",
      "freshness": "fresh",
      "alerts": [
        {
          "code": "completeness_unknown",
          "severity": "blocking",
          "message": "completeness was not measured",
          "blocks_promotion": true
        },
        {
          "code": "access_or_contract_failure",
          "severity": "blocking",
          "message": "outcome=source_unavailable",
          "blocks_promotion": true
        }
      ],
      "can_promote": false,
      "recommended_smoke": "weekly",
      "parser_version": null,
      "technical_gate": false,
      "technical_promotion_eligible": false
    },
    {
      "provider": "stf_informativo",
      "freshness": "fresh",
      "alerts": [
        {
          "code": "completeness_unknown",
          "severity": "blocking",
          "message": "completeness was not measured",
          "blocks_promotion": true
        },
        {
          "code": "access_or_contract_failure",
          "severity": "blocking",
          "message": "outcome=source_unavailable",
          "blocks_promotion": true
        }
      ],
      "can_promote": false,
      "recommended_smoke": "monthly",
      "parser_version": null,
      "technical_gate": false,
      "technical_promotion_eligible": false
    },
    {
      "provider": "stf_juris",
      "freshness": "stale",
      "alerts": [
        {
          "code": "evidence_expired",
          "severity": "blocking",
          "message": "bounded evidence exceeded its TTL",
          "blocks_promotion": true
        },
        {
          "code": "completeness_unknown",
          "severity": "blocking",
          "message": "completeness was not measured",
          "blocks_promotion": true
        },
        {
          "code": "access_or_contract_failure",
          "severity": "blocking",
          "message": "outcome=blocked_transport",
          "blocks_promotion": true
        }
      ],
      "can_promote": false,
      "recommended_smoke": "daily",
      "parser_version": null,
      "technical_gate": false,
      "technical_promotion_eligible": false
    },
    {
      "provider": "stj_dados_abertos_jurisprudencia",
      "freshness": "fresh",
      "alerts": [
        {
          "code": "completeness_unknown",
          "severity": "blocking",
          "message": "completeness was not measured",
          "blocks_promotion": true
        }
      ],
      "can_promote": false,
      "recommended_smoke": "weekly",
      "parser_version": null,
      "technical_gate": true,
      "technical_promotion_eligible": false
    },
    {
      "provider": "stj_informativo",
      "freshness": "fresh",
      "alerts": [
        {
          "code": "completeness_unknown",
          "severity": "blocking",
          "message": "completeness was not measured",
          "blocks_promotion": true
        }
      ],
      "can_promote": false,
      "recommended_smoke": "weekly",
      "parser_version": null,
      "technical_gate": true,
      "technical_promotion_eligible": false
    },
    {
      "provider": "stj_scon",
      "freshness": "stale",
      "alerts": [
        {
          "code": "evidence_expired",
          "severity": "blocking",
          "message": "bounded evidence exceeded its TTL",
          "blocks_promotion": true
        },
        {
          "code": "completeness_unknown",
          "severity": "blocking",
          "message": "completeness was not measured",
          "blocks_promotion": true
        }
      ],
      "can_promote": false,
      "recommended_smoke": "daily",
      "parser_version": null,
      "technical_gate": false,
      "technical_promotion_eligible": false
    },
    {
      "provider": "stm_jurisprudencia",
      "freshness": "fresh",
      "alerts": [
        {
          "code": "completeness_unknown",
          "severity": "blocking",
          "message": "completeness was not measured",
          "blocks_promotion": true
        }
      ],
      "can_promote": false,
      "recommended_smoke": "weekly",
      "parser_version": null,
      "technical_gate": true,
      "technical_promotion_eligible": false
    },
    {
      "provider": "tce_pr_viajuris",
      "freshness": "fresh",
      "alerts": [
        {
          "code": "completeness_unknown",
          "severity": "blocking",
          "message": "completeness was not measured",
          "blocks_promotion": true
        }
      ],
      "can_promote": false,
      "recommended_smoke": "weekly",
      "parser_version": null,
      "technical_gate": true,
      "technical_promotion_eligible": false
    },
    {
      "provider": "tce_sp_jurisprudencia",
      "freshness": "stale",
      "alerts": [
        {
          "code": "evidence_expired",
          "severity": "blocking",
          "message": "bounded evidence exceeded its TTL",
          "blocks_promotion": true
        },
        {
          "code": "completeness_unknown",
          "severity": "blocking",
          "message": "completeness was not measured",
          "blocks_promotion": true
        }
      ],
      "can_promote": false,
      "recommended_smoke": "daily",
      "parser_version": null,
      "technical_gate": false,
      "technical_promotion_eligible": false
    },
    {
      "provider": "tcu_jurisprudencia",
      "freshness": "fresh",
      "alerts": [
        {
          "code": "completeness_unknown",
          "severity": "blocking",
          "message": "completeness was not measured",
          "blocks_promotion": true
        }
      ],
      "can_promote": false,
      "recommended_smoke": "weekly",
      "parser_version": null,
      "technical_gate": true,
      "technical_promotion_eligible": false
    },
    {
      "provider": "tjac_cjsg",
      "freshness": "stale",
      "alerts": [
        {
          "code": "evidence_expired",
          "severity": "blocking",
          "message": "bounded evidence exceeded its TTL",
          "blocks_promotion": true
        },
        {
          "code": "completeness_unknown",
          "severity": "blocking",
          "message": "completeness was not measured",
          "blocks_promotion": true
        }
      ],
      "can_promote": false,
      "recommended_smoke": "daily",
      "parser_version": null,
      "technical_gate": true,
      "technical_promotion_eligible": false
    },
    {
      "provider": "tjac_ementario_jurisprudencia",
      "freshness": "fresh",
      "alerts": [
        {
          "code": "completeness_unknown",
          "severity": "blocking",
          "message": "completeness was not measured",
          "blocks_promotion": true
        }
      ],
      "can_promote": false,
      "recommended_smoke": "weekly",
      "parser_version": null,
      "technical_gate": true,